title,pov,tod,setting,desc
"Simple Text","Mercury","morning","Mr. Mercury's front yard.","An important scene."
"A Chapter Can Be Named Anything That You Can Possibly Imagine in All of The World ... And So Can A Scene","Venus","noon","Ms. Venus's front yard.","An important scene."
"Lists","Earth","afternoon","Miss Earth's front yard.","Any of these can be missing ..."
"Links","Mars","evening","Mar's front yard.",""
"Quotes and Footnotes","Jupiter","","Jupiter's front yard.","See? The previous one was missing."
